{
  "schema": "TickTockReviewDecision/1.0",
  "gate_id": "G-TICKTOCK-REVIEW",
  "decision_id": "tt-review-20260812T040400Z",
  "produced_by_step": "S4-C",
  "created_at": "2026-08-12T04:04:00Z",
  "charter_id": "s4c-distinct-minds-trial.20260812",
  "charter_hash": "1fde5068388fc68f29fcc9ea5ec683b39992edb8f0732f14283568f5559691dc",
  "roster_hash": "6789acbf658c3b628968d66c76f733f76ed121cb580f3dc1ddd8dfcb6f8101af",
  "reviewers": [
    {
      "lane_id": "codex-1",
      "family": "codex",
      "model_pin_requested": "gpt-5-codex",
      "model_pin_observed": "gpt-5-codex",
      "pin_verified": true,
      "status": "clean",
      "verdict": "APPROVE",
      "unresolved_findings": 0,
      "review_artifact_path": "Review leg 2026-08-12T01:40Z (pin self-report 'gpt-5-codex', first line): AMEND_REQUIRED, 2 findings — preflight-and-journal.cjs dropped its --charter so the gate bound against a default charter, and evaluateTicktockReview accepted any non-empty clean reviewer set (a one-lane decision could clear a three-lane roster). Both fixed same session (runCharterPath pass-through + run-charter identity refusal; exact roster coverage with ROSTER-COVERAGE-MISMATCH/UNRESOLVED, six test arms). Re-verification leg 2026-08-12T01:44Z (pin self-report 'gpt-5-codex', first line): both FIXED with file:line evidence, live preflight confirmed refusing DECISION-NOT-CLEARED, the stored S4-B decision correctly reads CHARTER-BINDING-MISMATCH under this charter, verdict CLEAN. Sandbox EPERM prevented its own suite run (12 live-probe passes before write-blocked arms); suites verified 17/17 + 16/16 by coordinator and independently by the codewhale lane. Session 703cfd24 transcript."
    },
    {
      "lane_id": "gemini-1",
      "family": "gemini",
      "model_pin_requested": "gemini-2.5-pro",
      "model_pin_observed": "gemini-2.5-pro",
      "pin_verified": true,
      "status": "clean",
      "verdict": "APPROVE",
      "unresolved_findings": 0,
      "review_artifact_path": "_dev/reports/analysis/gemini-last-message__20260812T013844Z__s4c-gemini-lane.md — pin self-report 'gemini-2.5-pro' leading the final plain-text message; static review of the gate machinery, live-probe, charter/journal integrity, and binding checks; honest disclosure that its environment cannot execute tests; six substantive verified points; APPROVE, zero findings. (Two earlier transport failures on this family tonight are recorded in the superseded S4-B decision and in this charter's availability notes; this run's output stream completed cleanly under the plain-text-final instruction.)"
    },
    {
      "lane_id": "codewhale-1",
      "family": "deepseek",
      "model_pin_requested": "deepseek-v4-flash",
      "model_pin_observed": "deepseek-v4-flash",
      "pin_verified": true,
      "status": "clean",
      "verdict": "APPROVE",
      "unresolved_findings": 0,
      "review_artifact_path": "Review leg: _dev/reports/analysis/codewhale-last-message__20260812T013851Z__s4c-codewhale-lane.md (pin self-report 'deepseek-v4-flash') — AMEND_REQUIRED, 4 doc-staleness findings (stale decision-id citations x5, stale preflight header, pinned drifting test counts, wrong custody-gate line citation), zero behavioral defects; independently executed both suites (17/17, 16/16), verified live preflight, hash binding, benchmark identical:true against the re-fingerprint, and dryrun-003 journal/anchor/manifest coherence end-to-end. All four fixed same session with the root cause removed (prose no longer pins decision ids; citations defer to require-sites). Re-verification leg: _dev/reports/analysis/codewhale-cli-run__20260812T015118Z__s4c-codewhale-reverify.md (pin self-report 'deepseek-v4-flash') — all four FIXED, no new staleness, suites pass; verdict CLEAN."
    }
  ],
  "decision": {
    "cleared": true,
    "unresolved_findings_total": 0,
    "reasons": [],
    "decided_at": "2026-08-12T04:04:00Z",
    "decided_by": "operator ratification, verbatim 2026-08-12T01:37Z: '1. rebaseline 2. Roster Approved. 3. Accepted 4. lets do this' — decision assembled by session 703cfd24 (coordinator, not producer of the /tt implementation; the fixes each lane confirmed were re-verified by that lane's own family, never by their producer alone); re-issued by session 07070e52 with the stamp moved into the operator_stamp FIELD the gate reads (stamp re-confirmed by the operator in-session 2026-08-12T04:03Z)",
    "operator_stamp": "1. rebaseline 2. Roster Approved. 3. Accepted 4. lets do this"
  }
}
